type|title|pub_year|author|volume|number|pages|journal|publisher|abstract|url|title_upper
journal|Atmospheric waves and global seismoacoustic observations of the January 2022 Hunga eruption, Tonga|2022|Robin S Matoza and David Fee and Jelle D Assink and Alexandra M Iezzi and David N Green and Keehoon Kim and Liam Toney and Thomas Lecocq and Siddharth Krishnamoorthy and Jean-Marie Lalande and Kiwamu Nishida and Kent L Gee and Matthew M Haney and Hugo D Ortiz and Quentin Brissaud and Léo Martire and Lucie Rolland and Panagiotis Vergados and Alexandra Nippress and Junghyun Park and Shahar Shani-Kadmiel and Alex Witsil and Stephen Arrowsmith and Corentin Caudron and Shingo Watada and Anna B Perttu and Benoit Taisne and Pierrick Mialle and Alexis Le Pichon and Julien Vergoz and Patrick Hupe and Philip S Blom and Roger Waxler and Silvio De Angelis and Jonathan B Snively and Adam T Ringler and Robert E Anthony and Arthur D Jolly and Geoff Kilgour and Gil Averbuch and Maurizio Ripepe and Mie Ichihara and Alejandra Arciniega-Ceballos and Elvira Astafyeva and Lars Ceranna and Sandrine Cevuard and Il-Young Che and Rodrigo De Negri and Carl W Ebeling and Läslo G Evers and Luis E Franco-Marin and Thomas B Gabrielson and Katrin Hafner and R Giles Harrison and Attila Komjathy and Giorgio Lacanna and John Lyons and Kenneth A Macpherson and Emanuele Marchetti and Kathleen F McKee and Robert J Mellors and Gerardo Mendo-Pérez and T Dylan Mikesell and Edhah Munaibari and Mayra Oyola-Merced and Iseul Park and Christoph Pilger and Cristina Ramos and Mario C Ruiz and Roberto Sabatini and Hans F Schwaiger and Dorianne Tailpied and Carrick Talmadge and Jérôme Vidot and Jeremy Webster and David C Wilson|377|6601|95-100|Science|American Association for the Advancement of Science|The 15 January 2022 climactic eruption of Hunga volcano, Tonga, produced an explosion in the atmosphere of a size that has not been documented in the modern geophysical record. The event generated a broad range of atmospheric waves observed globally by various ground-based and spaceborne instrumentation networks. Most prominent was the surface-guided Lamb wave (≲0.01 hertz), which we observed propagating for four (plus three antipodal) passages around Earth over 6 days. As measured by the Lamb wave amplitudes, the climactic Hunga explosion was comparable in size to that of the 1883 Krakatau eruption. The Hunga eruption produced remarkable globally detected infrasound (0.01 to 20 hertz), long-range (~10,000 kilometers) audible sound, and ionospheric perturbations. Seismometers worldwide recorded pure seismic and air-to-ground coupled waves. Air-to-sea coupling likely …|https://www.science.org/doi/abs/10.1126/science.abo7063|ATMOSPHERIC WAVES AND GLOBAL SEISMOACOUSTIC OBSERVATIONS OF THE JANUARY 2022 HUNGA ERUPTION, TONGA
journal|SPECFEM2D-DG, an open-source software modelling mechanical waves in coupled solid–fluid systems: the linearized Navier–Stokes approach|2022|Léo Martire and R Martin and Q Brissaud and RF Garcia|228|1|664-697|Geophysical Journal International|Oxford University Press|We introduce SPECFEM2D-DG, an open-source, time-domain, hybrid Galerkin software modelling the propagation of seismic and acoustic waves in coupled solid–fluid systems. For the solid part, the visco-elastic system from the routinely used SPECFEM2D software is used to simulate linear seismic waves subject to attenuation. For the fluid part, SPECFEM2D-DG includes two extensions to the acoustic part of SPECFEM2D, both relying on the Navier–Stokes equations to model high-frequency acoustics, infrasound and gravity waves in complex atmospheres. The first fluid extension, SPECFEM2D-DG-FNS, was introduced in 2017 by Brissaud, Martin, Garcia, and Komatitsch; it features a nonlinear Full Navier–Stokes (FNS) approach discretized with a discontinuous Galerkin numerical scheme. In this contribution, we focus only on introducing a second fluid extension, SPECFEM2D-DG-LNS, based on the …|https://academic.oup.com/gji/article-abstract/228/1/664/6342174|SPECFEM2D-DG, AN OPEN-SOURCE SOFTWARE MODELLING MECHANICAL WAVES IN COUPLED SOLID–FLUID SYSTEMS: THE LINEARIZED NAVIER–STOKES APPROACH
journal|IMS observations of infrasound and acoustic-gravity waves produced by the January 2022 volcanic eruption of Hunga, Tonga: A global analysis|2022|Julien Vergoz and Patrick Hupe and Constantino Listowski and Alexis Le Pichon and MA Garcés and Emanuele Marchetti and Philippe Labazuy and Lars Ceranna and Christoph Pilger and Peter Gaebler and Sven Peter Näsholm and Quentin Brissaud and P Poli and Nikolai Shapiro and R De Negri and Pierrick Mialle|591|N/A|117639|Earth and Planetary Science Letters|Elsevier|The 15 January 2022 Hunga, Tonga, volcano's explosive eruption produced the most powerful blast recorded in the last century, with an estimated equivalent TNT yield of 100–200 megatons. The blast energy was propagated through the atmosphere as various wave types. The most prominent wave was a long-period (>2000 s) surface-guided Lamb wave with energy comparable to that of the 1883 Krakatoa Lamb wave; both were clearly observed by pressure sensors (barometers) worldwide. Internal gravity, acoustic-gravity, and infrasound waves were captured in great detail by the entire infrasound component of the International Monitoring System (IMS). For instance, infrasound waves (<300 s period) were seen to circumnavigate Earth up to eight times. Atmospheric waves captured by the IMS infrasound network and selected barometers near the source provide insight on Earth's impulse response at planetary …|https://www.sciencedirect.com/science/article/pii/S0012821X22002758|IMS OBSERVATIONS OF INFRASOUND AND ACOUSTIC-GRAVITY WAVES PRODUCED BY THE JANUARY 2022 VOLCANIC ERUPTION OF HUNGA, TONGA: A GLOBAL ANALYSIS
journal|Parsimonious velocity inversion applied to the Los Angeles Basin, CA|2022|Jack B Muir and Robert W Clayton and Victor C Tsai and Quentin Brissaud|127|2|e2021JB023103|Journal of Geophysical Research: Solid Earth|N/A|The proliferation of dense arrays promises to improve our ability to image geological structures at the scales necessary for accurate assessment of seismic hazard. However, combining the resulting local high‐resolution tomography with existing regional models presents an ongoing challenge. We developed a framework based on the level‐set method that infers where local data provide meaningful constraints beyond those found in regional models ‐ for example the Community Velocity Models (CVMs) of southern California. This technique defines a volume within which updates are made to a reference CVM, with the boundary of the volume being part of the inversion rather than explicitly defined. By penalizing the complexity of the boundary, a minimal update that sufficiently explains the data is achieved. To test this framework, we use data from the Community Seismic Network, a dense permanent urban …|https://agupubs.onlinelibrary.wiley.com/doi/abs/10.1029/2021JB023103|PARSIMONIOUS VELOCITY INVERSION APPLIED TO THE LOS ANGELES BASIN, CA
journal|Near-real-time detection of co-seismic ionospheric disturbances using machine learning|2022|Quentin Brissaud and Elvira Astafyeva|230|3|2117-2130|Geophysical Journal International|Oxford University Press|Tsunamis generated by large earthquake-induced displacements of the ocean floor can lead to tragic consequences for coastal communities. Measurements of co-seismic ionospheric disturbances (CIDs) offer a unique solution to characterize an earthquake’s tsunami potential in near-real-time (NRT) since CIDs can be detected within 15 min of a seismic event. However, the detection of CIDs relies on human experts, which currently prevents the deployment of ionospheric methods in NRT. To address this critical lack of automatic procedure, we designed a machine-learning-based framework to (1) classify ionospheric waveforms into CIDs and noise, (2) pick CID arrival times and (3) associate arrivals across a satellite network in NRT. Machine-learning models (random forests) trained over an extensive ionospheric waveform data set show excellent classification and arrival-time picking performances …|https://academic.oup.com/gji/article-abstract/230/3/2117/6576768|NEAR-REAL-TIME DETECTION OF CO-SEISMIC IONOSPHERIC DISTURBANCES USING MACHINE LEARNING
journal|Supplementary Material for” SPECFEM2D-DG, an Open Source Software Modeling Mechanical Waves in Coupled Solid-Fluid Systems: the Linearised Navier-Stokes Approach”|2021|Léo Martire and R Martin and Q Brissaud and RF Garcia|N/A|N/A|N/A|N/A|N/A|Table S1. Detailed scalar expressions of the LNS’strong formulation terms, as defined in Eq.(2). These play a role in the volume terms of the weak formulation detailed in Appendix B1. The notations are that of Eq.(2), as well as some additional ones provided in Section 3. Here, only the case d= 2 is presented. Generalization to d= 3 is straightforward, though more tedious to write down. q Σ Σx Σz G F ρ δm δm, x δm, z 0 Fρ ρ0vx[ρ0v0⊗ v+ p I− ℵ] 1,: ρ0v0, xvx+ p− ℵ 11 ρ0v0, xvz− ℵ 12 ρ gx−(δm·∇) v0, x Fvx+ vxFρ ρ0vz[ρ0v0⊗ v+ p I− ℵ] 2,: ρ0v0, zvx− ℵ 21 ρ0v0, zvz+ p− ℵ 22 ρ gz−(δm·∇) v0, z Fvz+ vzFρ|https://authors.library.caltech.edu/records/0zsqk-6g036/files/ggab308_supplemental_file.pdf?download=1|SUPPLEMENTARY MATERIAL FOR” SPECFEM2D-DG, AN OPEN SOURCE SOFTWARE MODELING MECHANICAL WAVES IN COUPLED SOLID-FLUID SYSTEMS: THE LINEARISED NAVIER-STOKES APPROACH”
conference|Estimation of infrasound-consistent wind and temperature atmospheric profiles from model ensembles in North Scandinavia|2021|Ismael Vera Rodriguez and Sven Peter Näsholm and Quentin Brissaud and Antoine Turquet and Alexis Le Pichon|N/A|N/A|EGU21-1384|EGU General Assembly Conference Abstracts|N/A|Atmospheric reanalysis models rely on the assimilation of direct and indirect measurements of different properties of the atmosphere. A better representation of the upper stratosphere in these models, especially for winds, can contribute to enhanced numerical weather predictions on weekly to monthly timescales. Infrasound waves provide complementary information to characterize the middle atmosphere. This is particularly valuable above 30 km altitude where few other currently available technologies provide direct measurements, especially for the dynamics. In the current work, we update ensemble-averaged ERA5 atmospheric models to become consistent with sets of infrasound array observations of travel-time, backazimuth, and apparent velocity. The atmosphere is simplified to a layered, time-invariant representation, which is considered valid for infrasound propagation at regional distances (< 400km). The …|https://ui.adsabs.harvard.edu/abs/2021EGUGA..23.1384R/abstract|ESTIMATION OF INFRASOUND-CONSISTENT WIND AND TEMPERATURE ATMOSPHERIC PROFILES FROM MODEL ENSEMBLES IN NORTH SCANDINAVIA
journal|Progress towards balloon-based seismology on Venus in 2020-2021.|2021|S Krishnamoorthy and L Martire and Daniel Bowman and J Jacob and B Elbing and E Hough and Z Yap and M Lammes and H Linzy and T Swaim and A Vance and MT Pauken and JA Cutts and JM Jackson and RF Garcia and D Mimoun|N/A|SAND2021-14007C|N/A|N/A|Sandia National Lab.(SNL-NM), Albuquerque, NM (United States)|The evolution and interior structure of Venus remain uncertain despite half a century of exploration. This is in large part due to the absence of seismology investigations, which have yielded much of the information about Earth’s interior. Extreme surface temperature (> 460 C) and pressure (> 90 atmospheres) result in extremely limited lifetimes for surface missions.Venus’ thick atmosphere allows for the efficient coupling of seismic waves between the solid planet and its atmosphere resulting in low-frequency pressure waves, also known as infrasound. Infrasound travels relatively unattenuated for large distances and may be used to study seismic activity on Venus without needing to land on it. Infrasound barometers may be deployed on balloons floating at 50-60 km altitude on Venus, where the temperature and pressure are much more benign and longer mission lifetimes can be guaranteed.|https://www.osti.gov/servlets/purl/1896861|PROGRESS TOWARDS BALLOON-BASED SEISMOLOGY ON VENUS IN 2020-2021.
conference|Detection of co-seismic ionospheric disturbances in near-real-time by using machine learning|2021|Quentin Brissaud and Elvira Astafyeva|2021|N/A|SA11B-01|AGU Fall Meeting Abstracts|N/A|Tsunamis generated by large earthquake-induced displacements of the ocean floor can lead to tragic consequences for coastal communities. Ionospheric measurements of Co-Seismic Disturbances (CIDs) offer a unique solution to characterize an earthquake's tsunami potential in Near-Real-Time (NRT) since CIDs can be detected within 7-10 min of a seismic event. However, the detection of CIDs rely on human experts which currently prevents the deployment of ionospheric methods in NRT. To address this critical lack of automatic procedure, we build a Machine Learning (ML) model using random forests to (1) classify ionospheric waveforms between CIDs and noise,(2) pick arrival times, and (3) associate arrivals across a satellite network in NRT. The ML model was trained over an extensive dataset of GNSS-derived total electron content (TEC) signatures for 12 large-magnitude earthquakes and it shows …|https://ui.adsabs.harvard.edu/abs/2021AGUFMSA11B..01B/abstract|DETECTION OF CO-SEISMIC IONOSPHERIC DISTURBANCES IN NEAR-REAL-TIME BY USING MACHINE LEARNING
conference|Using Sensitivity Kernels to Untangle Basin Path and Site Amplification Effects|2021|Daniel Bowden and Marta Pienkowska-Cote and Christian Boehm and Andreas Fichtner and Quentin Brissaud|2021|N/A|S11A-03|AGU Fall Meeting Abstracts|N/A|Many existing works explore how seismic waves propagate and amplify in the shallow crust, thus increasing seismic hazard in particular regions. For example, shallow soils can give rise to resonances and amplifications, sedimentary basins can focus wavefronts or convert seismic phases, topography can scatter or steer the wavefield, and so on. Seismologists have traditionally relied on careful analytic theory, simulations, and detailed waveform analysis to understand how these various effects interact and compete. To better understand how different regions of the shallow subsurface relate to the observed amplitudes, we turn to adjoint-based sensitivity kernels. Well established in full-waveform tomographic applications, sensitivity kernels usually describe which part of a velocity model might be modified to decrease a misfit between synthetic and observed seismograms. Instead, we follow a framework from Day …|https://ui.adsabs.harvard.edu/abs/2021AGUFM.S11A..03B/abstract|USING SENSITIVITY KERNELS TO UNTANGLE BASIN PATH AND SITE AMPLIFICATION EFFECTS
journal|The first detection of an earthquake from a balloon using its acoustic signature|2021|Quentin Brissaud and Siddharth Krishnamoorthy and Jennifer M Jackson and Daniel C Bowman and Attila Komjathy and James A Cutts and Zhongwen Zhan and Michael T Pauken and Jacob S Izraelevitz and Gerald J Walsh|48|12|e2021GL093013|Geophysical Research Letters|N/A|Extreme temperature and pressure conditions on the surface of Venus present formidable technological challenges against performing ground‐based seismology. Efficient coupling between the Venusian atmosphere and the solid planet theoretically allows the study of seismically generated acoustic waves using balloons in the upper atmosphere, where conditions are far more clement. However, earthquake detection from a balloon has never been demonstrated. We present the first detection of an earthquake from a balloon‐borne microbarometer near Ridgecrest, CA in July 2019 and include a detailed analysis of the dependence of seismic infrasound, as measured from a balloon on earthquake source parameters, topography, and crustal and atmospheric structure. Our comprehensive analysis of seismo‐acoustic phenomenology demonstrates that seismic activity is detectable from a high‐altitude platform on …|https://agupubs.onlinelibrary.wiley.com/doi/abs/10.1029/2021GL093013|THE FIRST DETECTION OF AN EARTHQUAKE FROM A BALLOON USING ITS ACOUSTIC SIGNATURE
conference|Near and far-field seismo-acoustic analysis of mb 4.9 mining induced earthquake nearby Kiruna, Sweden|2021|Antoine Turquet and Quentin Brissaud and Sven Peter Näsholm and Johan Kero and Tormod Kværna and Constantino Listowski and Alexis Le Pichon|N/A|N/A|EGU21-8343|EGU General Assembly Conference Abstracts|N/A|An earthquake happened in 18 May 2020 early morning in the Kiruna underground iron ore mine, Northern Sweden having a magnitude Mw 4.9. Following the earthquake, the mine was immediately evacuated because of the risk of aftershocks. This event is the largest mining-induced earthquake that has ever taken place in Scandinavia and it produced signals recorded by three infrasound arrays at distances of 7 km (KRIS, Sweden), 155 km (IS37, Norway) and 286 km (ARCI, Norway). We explore seismo-acoustic features of this event recorded in near and far-field. This procedure allows us to track how the signal propagated in the solid earth until the seismometers located at various distances or transmitted to the atmosphere and propagated further to the infrasound stations. Our study also provides a detailed comparison between observed and predicted wave front characteristics at the arrays. We conduct a …|https://ui.adsabs.harvard.edu/abs/2021EGUGA..23.8343T/abstract|NEAR AND FAR-FIELD SEISMO-ACOUSTIC ANALYSIS OF MB 4.9 MINING INDUCED EARTHQUAKE NEARBY KIRUNA, SWEDEN
journal|Inflation and asymmetric collapse at Kīlauea summit during the 2018 eruption from seismic and infrasound analyses|2021|Voon Hui Lai and Zhongwen Zhan and Quentin Brissaud and Osamu Sandanbata and Meghan S Miller|126|10|e2021JB022139|Journal of Geophysical Research: Solid Earth|N/A|Characterizing the large M4.7+ seismic events during the 2018 Kīlauea eruption is important to understand the complex subsurface deformation at the Kīlauea summit. The first 12 events (May 17–May 26) are associated with long‐duration seismic signals and the remaining 50 events (May 29–August 2) are accompanied by large‐scale caldera collapses. Resolving the source location and mechanism is challenging because of the shallow source depth, significant nondouble‐couple components, and complex velocity structure. We demonstrate that combining multiple geophysical data from broadband seismometers, accelerometers, and infrasound is essential to resolve different aspects of the seismic source. Seismic moment tensor solutions using near‐field summit stations show the early events are inflationary. Infrasound data and particle motion analysis identify the source of inflation as the Halema'uma'u …|https://agupubs.onlinelibrary.wiley.com/doi/abs/10.1029/2021JB022139|INFLATION AND ASYMMETRIC COLLAPSE AT KĪLAUEA SUMMIT DURING THE 2018 ERUPTION FROM SEISMIC AND INFRASOUND ANALYSES
conference|Advances towards Balloon-based Seismic Studies on Venus|2020|Siddharth Krishnamoorthy and Attila Komjathy and James A Cutts and Michael Pauken and Daniel C Bowman and Quentin Brissaud and Jennifer M Jackson and Raphael F Garcia and David Mimoun and Jacob Izraelevitz|2020|N/A|P026-0006|AGU Fall Meeting Abstracts|N/A|Seismology is essential for understanding a planet's interior structure and evolution. Earth, Moon, and Mars have all hosted seismic instruments on the surface, which have mapped seismic activity and provided insight into their interior. On Venus, high surface temperature and pressure present a difficult technological challenge to traditional seismology. In recent years, balloon-based seismology through the study of low-frequency seismo-acoustic signals (infrasound) has gained acceptance as a viable way to study seismic activity on Venus. Balloon-based barometers have the potential to detect and characterize atmospheric waves launched by venusquakes and volcanic eruptions while offering substantially longer instrument lifetimes in the Venus middle atmosphere, where temperature and pressure are significantly more benign (-10-100 C) as compared to the surface (> 460 C). A balloon-based investigation of …|https://ui.adsabs.harvard.edu/abs/2020AGUFMP026.0006K/abstract|ADVANCES TOWARDS BALLOON-BASED SEISMIC STUDIES ON VENUS
journal|Evidence of Ionospheric Perturbations from a Buried Chemical Explosion captured using High-Rate GNSS Measurements.|2020|Attila Komjathy and Siddharth Krishnamoorthy and Daniel Bowman and Quentin Brissoud and James A Cutts|N/A|SAND2020-12950C|N/A|N/A|Sandia National Lab.(SNL-NM), Albuquerque, NM (United States)|Background• Natural and anthropogenic hazards generate waves in the thermosphere and ionosphere that may be detected using ground and space-based GPS observations.|https://www.osti.gov/servlets/purl/1832630|EVIDENCE OF IONOSPHERIC PERTURBATIONS FROM A BURIED CHEMICAL EXPLOSION CAPTURED USING HIGH-RATE GNSS MEASUREMENTS.
journal|Progress Towards Balloon-Based Seismology on Venus in 2019-2020|2020|J Izraelevitz and D Mimoun and RF Garcia and Y Chaigneau and L Martire and JM Jackson and Q Brissaud and DC Bowman and JA Cutts and MT Pauken and A Komjathy and S Krishnamoorthy|N/A|N/A|N/A|N/A|Pasadena, CA: Jet Propulsion Laboratory, National Aeronautics and Space Administration, 2020|N/A|https://ntrs.nasa.gov/citations/20220001972|PROGRESS TOWARDS BALLOON-BASED SEISMOLOGY ON VENUS IN 2019-2020
conference|In-depth seismo-acoustic analysis of mining-induced Mw 4.9 Kiruna earthquake|2020|Antoine Turquet and Johan Kero and Quentin Brissaud and S Peter Näsholm and Tormod Kvaerna and A LE Pichon|2020|N/A|S001-0007|AGU Fall Meeting Abstracts|N/A|The mining operations in Kiruna, Sweden caused an earthquake Mw 4.9 in 18 May 2020 early morning. According to Swedish media, the mine was immediately evacuated afterwards because of the risk of aftershocks. This event is the largest magnitude mining-induced earthquake that has ever taken place in Scandinavia and produced signals recorded by three infrasound arrays at distances of 7 km (KIR, Sweden), 155 km (IS37, Norway) and 286 km (ARCI, Norway). Our study investigates seismo-acoustic characteristic features of this event recorded in near and far-field. We focus particularly on how the signal propagated in the atmosphere and in the earth. We provide a detailed comparison between the observed and predicted wave front characteristics at the arrays. We also conduct a comparison of amplitude corrected for propagation effect versus magnitude and ground shaking amplitude. These results show …|https://ui.adsabs.harvard.edu/abs/2020AGUFMS001.0007T/abstract|IN-DEPTH SEISMO-ACOUSTIC ANALYSIS OF MINING-INDUCED MW 4.9 KIRUNA EARTHQUAKE
journal|Extension of the basin Rayleigh‐wave amplification theory to include basin‐edge effects|2020|Quentin Brissaud and Daniel C Bowden and Victor C Tsai|110|3|1305-1322|Bulletin of the Seismological Society of America|GeoScienceWorld|The presence of sediments near the Earth’s surface can significantly amplify the strength of shaking during earthquakes. Such basin or site amplification effects have been well documented in numerous regions, yet the complex and often situational dependence of competing reasons for this amplification makes it hard to quantify in a general sense or to determine the most significant contributions. Simple 1D seismic profiles can be used to estimate the amplitude differences between a basin site and a hard‐rock reference site, but this ignores any reflections or conversions at the basin edge or a resonance effect depending on the basin’s geometry. In this article, we explore an analytic model based on coupling coefficients for surface Rayleigh waves to account for the lateral discontinuities at a basin’s edge (Datta 2018). We use this simple tool to explore the relationship between the basin’s Rayleigh‐wave …|https://pubs.geoscienceworld.org/ssa/bssa/article/583439/Extension-of-the-Basin-RayleighWave-Amplification|EXTENSION OF THE BASIN RAYLEIGH‐WAVE AMPLIFICATION THEORY TO INCLUDE BASIN‐EDGE EFFECTS
conference|Investigating the Venusian surface-atmosphere dynamic coupling|2019|Panagiotis Vergados and Attila Komjathy and Quentin Brissaud and Chi O Ao and Tatiana M Bocanegra-Bahamon and Siddharth Krishnamoorthy and Robert Arthur Preston and Joseph Lazio and Sami W Asmar and David H Atkinson|2019|N/A|P31B-3434|AGU Fall Meeting Abstracts|N/A|The generation of regional-and global-scale waves and perturbations in the Venusian atmosphere, including gravity and planetary waves either from dynamic or topography features (eg, polar vortices, mountains, super-rotation, tides), reflects on Venus's surface-atmosphere coupling. Recent studies revealed that cross-link occultations among SmallSats would enable remote sensing of the Venusian atmosphere via the radio occultation (RO) technique, providing a much more uniform spatial and temporal coverage than other remote sensing approaches. We performed a series of wave propagation simulations to investigate the magnitude of the expected air density and temperature perturbations caused by surface features and topography, given a realistic background thermodynamic environment derived from spacecraft observations by Venus Express, Akatsuki, and Magellan. The role of horizontal wind speed in …|https://ui.adsabs.harvard.edu/abs/2019AGUFM.P31B3434V/abstract|INVESTIGATING THE VENUSIAN SURFACE-ATMOSPHERE DYNAMIC COUPLING
