type|title|pub_year|author|volume|number|pages|journal|publisher|abstract|url|title_upper
conference|The AIR project: Leveraging balloon pressure data for planetary exploration|2023|Quentin Brissaud and Sven Peter Näsholm and Antoine Turquet and Tina Kaschwich and Celine Marie Solberg|2023|335|S11G-0335|AGU Fall Meeting Abstracts|N/A|Our understanding of Earth's internal structure comes primarily from seismic waves that provide important constraints on subsurface seismic-velocity properties. However, traditional inversion methods cannot be implemented in regions of limited seismic-station coverage, in particular on Venus due to its harsh surface conditions but also in remote Earth regions. This lack of seismic data greatly limits our understanding of Venus' origin and evolution and Earth's subsurface. However, the mechanical coupling between the ground and its atmosphere enables the seismic energy to be transmitted into the atmosphere as low-frequency acoustic waves carrying information about the seismic source and the subsurface properties. While infrasound is traditionally recorded at ground-based stations, which suffers from the same in-situ deployment limitations as seismic stations, recent studies have demonstrated that balloon …|https://ui.adsabs.harvard.edu/abs/2023AGUFM.S11G0335B/abstract|THE AIR PROJECT: LEVERAGING BALLOON PRESSURE DATA FOR PLANETARY EXPLORATION
conference|Seismic and infrasound monitoring of military conflicts using machine learning|2023|Quentin Brissaud and Erik Myklebust and Ben Dando and Bettina Goertz-Allmann and Andreas Köhler and Johannes Schweitzer and Tormod Kvaerna|N/A|N/A|EGU-12236|EGU General Assembly Conference Abstracts|N/A|"Seismic and infrasound monitoring of military conflicts using machine learning Page 1 Seismic 
and infrasound monitoring of military conflicts using machine learning Quentin Brissaud, Erik 
Myklebust, Ben Dando, Bettina Goertz-Allmann, Andreas Köhler, Johannes Schweitzer, and 
Tormod Kvaerna May 4th, 2023 Page 2 Information sources • Hard to get objective data from 
ongoing military conflicts for peace monitoring purposes • Existing technologies suffer from 
cost/biases: • Satellite imagery – expensive and/or lack temporal resolution • Videos/Photographs 
– hard to authenticate • Reporters – expensive, dangerous, and limited temporal/spatial 
resolution • Alternative to complement existing data streams: seismo-acoustic monitoring? 
Page 3 Seismo-acoustic signature of military activity • There is a limited number of studies 
investigating the signature of military activity such as firearms, vehicles, artillery, and mortar • …"|https://quentinbrissaud.github.io/images/2023.05.04_Brissaud_Ukraine_ML_Sandia.pdf|SEISMIC AND INFRASOUND MONITORING OF MILITARY CONFLICTS USING MACHINE LEARNING
journal|Detection of small-magnitude Earthquakesusing balloon-borne infrasound sensors|2023|Quentin Brissaud and Siddharth Krishnamoorthy and Jennifer Jackson and Daniel Bowman and Attila Komjathy and James Cutts and Jacob Izraelevitz and Zhongwen Zhan and Yan Yang|N/A|N/A|N/A|Authorea Preprints|Authorea|The mechanical coupling between a planet and its atmosphere enables the conversion of seismic waves into infrasound waves, i.e. low-frequency pressure perturbations (< 20Hz), which propagate to the upper atmosphere. Since the characteristics of the seismically-induced pressure perturbations are connected to their seismic counterparts, they provide a unique opportunity to investigate the atmospheric and interior structures of a planet or to constrain source properties. However, in Earth’s remote regions, deploying seismic or infrasound networks at the surface can be a difficult task. Stratospheric balloon platforms equipped with pressure sensors have therefore gained interest since they provide a unique and inexpensive way to record pressure signals in the atmosphere with a low noise level. Yet, infrasound observations of Earthquakes on balloon platforms have never been reported in the literature. In this study, we investigate the seismo-acoustic wavefield generated by the aftershocks of the 2019 Ridgecrest sequence and other regional low-magnitude Earthquakes on July 22 and August 9, 2019 using four free-flying balloons equipped with pressure sensors. We observed a strong signal coherence after the largest event between seismic motions at the surface and balloon pressure variations which matches our numerical simulations. A first atmospheric earthquake detection is crucial to demonstrate the viability of this novel technique to monitor infrasound from natural and artificial seismicity on Earth, and the study of seismic activity on planets such as Venus.|https://essopenarchive.org/doi/full/10.1002/essoar.10505998.2|DETECTION OF SMALL-MAGNITUDE EARTHQUAKESUSING BALLOON-BORNE INFRASOUND SENSORS
conference|Using a machine learning and stochastics-founded model to provide near real-time stratospheric polar vortex diagnostics based on high-latitude infrasound data|2023|Mari Eggen and Alise Danielle Midtfjord and Ekaterina Vorobeva and Fred Espen Benth and Patrick Hupe and Quentin Brissaud and Yvan Orsolini and Alexis Le Pichon and Constantino Listowski and Sven Peter Näsholm|N/A|N/A|EGU-11977|EGU General Assembly Conference Abstracts|N/A|Acoustic waves below the frequency limit of human hearing-infrasound-can travel for thousands of kilometres in the atmosphere. The global propagation signature of infrasound is highly sensitive to the wind structure of the stratosphere. This work exploits processed continuous data from three high-latitude infrasound stations to characterize an aspect of the stratospheric polar vortex. Concretely, a mapping is developed which takes the infrasound data from these three stations as input and outputs an estimate of the polar cap zonal mean wind averaged over 60-90 degrees in latitude at the 1 hPa pressure level. This stratospheric diagnostic information is relevant to, for example, sudden stratospheric warming assessment and sub-seasonal prediction. The considered acoustic data is within a low-frequency regime globally dominated by so-called microbarom infrasound, which is continuously radiated into the …|https://ui.adsabs.harvard.edu/abs/2023EGUGA..2511977E/abstract|USING A MACHINE LEARNING AND STOCHASTICS-FOUNDED MODEL TO PROVIDE NEAR REAL-TIME STRATOSPHERIC POLAR VORTEX DIAGNOSTICS BASED ON HIGH-LATITUDE INFRASOUND DATA
journal|SEISMOLOGY ON VENUS USING BALLOON-BORNE MICROBAROMETERS.|2023|S Krishnamoorthy and DC Bowman and E Hough and Z Yap and J Jacob and B Elbing and L Martire and J Wilding and A Komjathy and MT Pauken and JA Cutts and JM Jackson and RF Garcia and D Mimoun and Q Brissaud and Norwegian Seismic Array|2807|N/A|8011|Venus Surface and Atmosphere. Held January 30-February 1, 2023 in Houston, Texas and virtually|N/A|Introduction: Adverse conditions on the surface of Venus have thus far prevented long-duration seismic studies. Traditional seismology on the surface of Venus using a long-lived lander is decades away. Since 2016, we have been developing remote sensing technology that would enable the detection and characterization of putative Venusian seismic activity from balloons in its upper atmosphere. In this presentation, we will discuss the development of a remote sensing technique to study Venus’ seismicity from its atmosphere.|https://www.hou.usra.edu/meetings/venussurface2023/pdf/8011.pdf|SEISMOLOGY ON VENUS USING BALLOON-BORNE MICROBAROMETERS.
journal|Exposing military attacks in the 2022 Russia-Ukraine conflict using seismic array data|2023|Ben Dando and Bettina Goertz-Allmann and Quentin Brissaud and Andreas Köhler and Johannes Schweitzer and Tormod Kværna|N/A|N/A|N/A|N/A|N/A|Seismometers are generally used by the research community to study local or distant earthquakes, but seismograms also contain critical observations from regional 1, 2 and global explosions 3, which can be used to better understand conflicts and identify potential breaches of international law. The large overpressure generated by an explosion, shakes the Earth’s atmosphere and subsurface, and the resulting ground motion can be recorded by seismometers, while the infrasound signals that propagate through the atmosphere can be detected by microbarometers. While this technology is used by the International Monitoring System 4 to monitor nuclear explosions as part of the Comprehensive Nuclear Test Ban Treaty, the detection and location of lower-yield military attacks requires a network of sensors much closer to the source of the explosions. Without dedicated sensor deployments, such networks are rarely available for conflict monitoring. Obtaining comprehensive and objective data that can be used to effectively monitor an active conflict zone therefore remains a significant challenge. We demonstrate how seismic waves generated by explosions in northern Ukraine can be recorded by a local network of seismometers and used to automatically identify individual attacks in close to real-time, providing an unprecedented view of an active conflict zone. Between February and November 2022, we observe over 1200 explosions from the Kyiv, Zhytomyr and Chernhiv provinces, providing accurate origin times, locations and magnitudes. We identify a range of seismo-acoustic signals associated with various types of military attacks, with the …|https://www.researchsquare.com/article/rs-2613796/latest|EXPOSING MILITARY ATTACKS IN THE 2022 RUSSIA-UKRAINE CONFLICT USING SEISMIC ARRAY DATA
journal|Identifying attacks in the Russia–Ukraine conflict using seismic array data|2023|Ben DE Dando and Bettina P Goertz-Allmann and Quentin Brissaud and Andreas Köhler and Johannes Schweitzer and Tormod Kværna and Alexander Liashchuk|621|7980|767-772|Nature|Nature Publishing Group UK|Seismometers are generally used by the research community to study local or distant earthquakes, but seismograms also contain critical observations from regional, and global explosions, which can be used to better understand conflicts and identify potential breaches of international law. Although seismic, infrasound and hydroacoustic technology is used by the International Monitoring System to monitor nuclear explosions as part of the Comprehensive Nuclear-Test-Ban Treaty, the detection and location of lower-yield military attacks requires a network of sensors much closer to the source of the explosions. Obtaining comprehensive and objective data that can be used to effectively monitor an active conflict zone therefore remains a substantial challenge. Here we show how seismic waves generated by explosions in northern Ukraine and recorded by a local network of seismometers can be used to automatically …|https://www.nature.com/articles/s41586-023-06416-7|IDENTIFYING ATTACKS IN THE RUSSIA–UKRAINE CONFLICT USING SEISMIC ARRAY DATA
journal|Predicting infrasound transmission loss using deep learning|2023|Quentin Brissaud and Sven Peter Näsholm and Antoine Turquet and Alexis Le Pichon|232|1|274-286|Geophysical Journal International|Oxford University Press|Modelling the spatial distribution of infrasound attenuation (or transmission loss, TL) is key to understanding and interpreting microbarometer data and observations. Such predictions enable the reliable assessment of infrasound source characteristics such as ground pressure levels associated with earthquakes, man-made or volcanic explosion properties, and ocean-generated microbarom wavefields. However, the computational cost inherent in full-waveform modelling tools, such as parabolic equation (PE) codes, often prevents the exploration of a large parameter space, that is variations in wind models, source frequency and source location, when deriving reliable estimates of source or atmospheric properties—in particular for real-time and near-real-time applications. Therefore, many studies rely on analytical regression-based heuristic TL equations that neglect complex vertical wind variations and the …|https://academic.oup.com/gji/article-abstract/232/1/274/6661419|PREDICTING INFRASOUND TRANSMISSION LOSS USING DEEP LEARNING
journal|Summarizing the research of the MADEIRA project-Middle atmosphere dynamics: exploiting infrasound using a multidisciplinary approach at high latitudes|2023|Sven Peter Näsholm and Javier Amezcua and Jelle D Assink and Evgenia Belova and Erik Mårten Blixt and Quentin Brissaud and Mari Dahl Eggen and Patrick J Espy and Robert Hibbins and Johan Kero and Tormod Kvaerna and Alexis Le Pichon and Yvan J Orsolini and Ismael Vera Rodriguez and Antoine Turquet and Ekaterina Vorobeva|N/A|N/A|EGU-7121|N/A|N/A|The MADEIRA project (Middle Atmosphere Dynamics: Exploiting Infrasound Using a Multidisciplinary Approach at High Latitudes) is a four-year basic research project finishing in the spring 2023, funded by the Research Council of Norway. Its primary objective has been in elucidating the 30-60 km altitude range over large spatial scales using wind and temperature constraints from infrasound data collected at Arctic stations. Wave propagation modelling and infrasound interpretation from well-characterized sources provide remote atmospheric sensing. These data are more continuous in space and time than from many other direct measurement techniques. An aim has been to constrain high-top atmospheric models and explore stratosphere-mesosphere coupling with meteor radar wind measurements sampling the 70-100 km altitude range in combination with the infrasonic data. Another ambition has been to …|https://ui.adsabs.harvard.edu/abs/2023EGUGA..25.7121N/abstract|SUMMARIZING THE RESEARCH OF THE MADEIRA PROJECT-MIDDLE ATMOSPHERE DYNAMICS: EXPLOITING INFRASOUND USING A MULTIDISCIPLINARY APPROACH AT HIGH LATITUDES
journal|SPECFEM2D-DG, an open-source software modelling mechanical waves in coupled solid-fluid systems: the linearized Navier-Stokes approach (vol 228, pg 664, 2022)|2022|Leo Martire and R Martin and Q Brissaud and RF Garcia|229|1|150-150|GEOPHYSICAL JOURNAL INTERNATIONAL|OXFORD UNIV PRESS|N/A|https://scholar.google.com/scholar?cluster=12372657141392785675&hl=en&oi=scholarr|SPECFEM2D-DG, AN OPEN-SOURCE SOFTWARE MODELLING MECHANICAL WAVES IN COUPLED SOLID-FLUID SYSTEMS: THE LINEARIZED NAVIER-STOKES APPROACH (VOL 228, PG 664, 2022)
conference|Seismoacoustics: A Planet's Dialog from the Ground to the Edge of Space I Online Poster Discussion-CANCELLED|2022|Quentin Brissaud and Léo Martire and Sven Peter Näsholm and Sarah Albert|N/A|N/A|N/A|N/A|AGU|N/A|https://scholar.google.com/scholar?cluster=11774581281483175947&hl=en&oi=scholarr|SEISMOACOUSTICS: A PLANET'S DIALOG FROM THE GROUND TO THE EDGE OF SPACE I ONLINE POSTER DISCUSSION-CANCELLED
conference|Training a recurrent neural network (RNN) to predict long-range infrasound ground-to-ground transmission loss in range-dependent realistic atmospheres|2022|Edouard Forestier and Quentin Brissaud and Sven Peter Näsholm and Alexis LE Pichon|2022|N/A|P22E-2120|AGU Fall Meeting Abstracts|N/A|This work exploits the application of recurrent neural networks (RNNs) to predict ground-to-ground infrasound transmission loss (TL) in a range-dependent atmosphere. Recently, deep-learning based models have shown promising results to predict infrasound attenuation (or transmission loss, TL) up to 1000 km from surface sources using convolutional neural networks [1]. Such predictions enable the assessment of infrasound source characteristics such as ground pressure levels associated with artificial (eg, explosions) or natural (eg, earthquakes, ocean-generated microbaroms) wavefields for near-real-time applications. In the current contribution, we present improvements made on this previous architecture to increase accuracy, extend the source-receiver range to 4000 km, and account for range-dependent gravity-wave type of smaller-scale perturbations to the background ERA5 atmospheric models. The …|https://ui.adsabs.harvard.edu/abs/2022AGUFM.P22E2120F/abstract|TRAINING A RECURRENT NEURAL NETWORK (RNN) TO PREDICT LONG-RANGE INFRASOUND GROUND-TO-GROUND TRANSMISSION LOSS IN RANGE-DEPENDENT REALISTIC ATMOSPHERES
journal|What can the sound of earthquakes tell us about a planet's interior structure?|2022|Quentin Brissaud and Siddharth Krishnamoorthy and Jennifer Jackson and Daniel Bowman and Attila Komjathy and James Cutts and Zhongwen Zhan and Michael Pauken and Jacob Izraelevitz and Gerald Walsh|N/A|N/A|N/A|Authorea Preprints|Authorea|Deploying seismic or infrasound arrays on the ground to probe a planet’s interior structure remains challenging in remote regions facing harsh surface conditions such as Venus with a surface temperature of 464°C. Fortunately, a fraction of the seismic energy transmits in the upper atmosphere as infrasound waves, i.e. low-frequency pressure perturbations (< 20Hz). On July 22, 2019, a heliotrope balloon, equipped with pressure sensors, was launched from the Johnson Valley, CA with the objective of capturing infrasound signals from the aftershock sequence of the 2019 Ridgecrest earthquake. At 16:27:36 UTC, the sound of a natural earthquake of Mw 4.2 was detected for the first time by a balloon platform. This observation offered the opportunity to attempt the first inversion of seismic velocities from the atmosphere. Shear velocities extracted by our analytical inversion method fell within a reasonable range from the values provided by regional tomographic models. While our analysis was limited by the observation’s low signal-to-noise ratio, future observations of seismic events from a network of balloons carrying multiple pressure sensors could provide excellent constraints on crustal properties. However, to build robust estimates of seismic properties, inversion procedures will have to account for uncertainties in terms of velocity models, source locations, and instrumental errors. In this contribution, we will discuss the current state of balloon-based observations, the sensitivity of the acoustic wavefield on subsurface properties, and perspectives on future inversions of seismically-induced acoustic data.|https://essopenarchive.org/doi/full/10.1002/essoar.10509367.1|WHAT CAN THE SOUND OF EARTHQUAKES TELL US ABOUT A PLANET'S INTERIOR STRUCTURE?
journal|Path effects on surface-wave amplification in sedimentary basins|2022|Quentin Brissaud and Daniel Bowden|N/A|N/A|N/A|Authorea Preprints|Authorea|Sedimentary basins strongly affect earthquake ground motions of both body and surface waves that propagate through them. Yet to characterize seismic hazards at a specific site, it is common practice to consider only the effects of near-surface geology on vertically propagating body waves despite surface waves often causing strong damage. Recently, Bowden & Tsai (2017) proposed an semi-analytical method to predict surface-wave basin amplification and noticed that certain large regional earthquake ground motions are under-predicted if surface waves are not properly accounted for. Since the theory is based on a 1-D approximation of the near-surface geologic structure and does not account for path effects, it is of interest to know how significantly such additional complexity affects the 1-D predictions. When considering deep basins, several other basin parameters play a role in the amplification of surface waves: transmission and conversion at the basin edge, basin shape, lateral resonance and focusing effects. As surface waves propagate back and forth in a highly dispersive medium, the amplification also varies strongly from the edge to the center of the basin. These effects are not always accounted for because of the cost of geophysical surveys that would accurately constrain the structure, the lack of earthquake data for empirical predictions, the poor understanding of what main factors are responsible for basin amplification, and the absence of quantitative estimates of their contribution to the overall amplification. The current study aims to provide quantitative estimates of the importance of these various path effects on surface waves …|https://www.authorea.com/doi/full/10.1002/essoar.10500410|PATH EFFECTS ON SURFACE-WAVE AMPLIFICATION IN SEDIMENTARY BASINS
conference|Progress Towards Balloon-Based Seismology on Venus in 2021–2022|2022|S Krishnamoorthy and DC Bowman and Emalee Hough and Zachary Yap and L Martire and J Wilding and J Jacob and B Elbing and A Komjathy and J Cutts and J Jackson and R Garcia and D Mimoun and M Pauken and Q Brissaud|20|2688|8008|20th Meeting of the Venus Exploration and Analysis Group (VEXAG)|N/A|Introduction: Adverse conditions on the surface of Venus have thus far prevented long-duration seismic studies. Traditional seismology on the surface of Venus using a long-lived lander is decades away. Since 2016, we have been developing remote sensing technology that would enable the detection and characterization of putative Venusian seismic activity from balloons in its upper atmosphere. In this presentation, we will discuss the progress our group has made in the last year.|https://www.hou.usra.edu/meetings/vexagnovember2022/pdf/8008.pdf|PROGRESS TOWARDS BALLOON-BASED SEISMOLOGY ON VENUS IN 2021–2022
journal|From InSight to Perseverance, Infrasound and Sound Recordings for Atmospheric Science and Surface-Atmosphere Interactions|2022|D Mimoun and N Murdoch and R Garcia and A Stott and A Cadu and M Gillier and Q Brissaud and L Martire and A Spiga and A Petculescu|2685|N/A|7012|Optimizing Planetary In Situ Surface-Atmosphere Interaction Investigations Workshop|N/A|"From InSight to Perseverance, Infrasound and Sound Recordings for Atmospheric Science 
and Surface-Atmosphere Interactions - NASA/ADS Now on home page ads icon ads Enable 
full ADS view NASA/ADS From InSight to Perseverance, Infrasound and Sound Recordings 
for Atmospheric Science and Surface-Atmosphere Interactions Mimoun, D. ; Murdoch, N. ; 
Garcia, R., F. ; Stott, A. ; Cadu, A. ; Gillier, M. ; Brissaud, Q. ; Martire, L. ; Spiga, A. ; Petculescu, 
A. Abstract This abstracts highlights the interest of infrasound and acoustic monitoring for 
planetary science. Publication: Optimizing Planetary In Situ Surface-Atmosphere Interaction 
Investigations Workshop Pub Date: June 2022 Bibcode: 2022LPICo2685.7012M full text 
sources Publisher | © The SAO/NASA Astrophysics Data System adshelp[at]cfa.harvard.edu 
The ADS is operated by the Smithsonian Astrophysical Observatory under NASA Cooperative …"|https://ui.adsabs.harvard.edu/abs/2022LPICo2685.7012M/abstract|FROM INSIGHT TO PERSEVERANCE, INFRASOUND AND SOUND RECORDINGS FOR ATMOSPHERIC SCIENCE AND SURFACE-ATMOSPHERE INTERACTIONS
conference|A global analysis of deep infrasound produced by the January 2022 eruption of Hunga volcano|2022|Julien Vergoz and Alexis Le Pichon and Constantino Listowski and Patrick Hupe and Christopher Pilger and Peter Gaebler and Lars Ceranna and Milton Garcés and Emanuele Marchetti and Philippe Labazuy and Pierrick Mialle and Quentin Brissaud and Peter Näsholm and Nikolai Shapiro and Piero Poli|N/A|N/A|EGU22-13598|EGU General Assembly Conference Abstracts|N/A|The eruption of Hunga volcano, Tonga is the most energetic event recorded by the infrasound component of the global International Monitoring System (IMS). Infrasound, acoustic-gravity and Lamb waves were recorded by all 53 operational stations after circling four times the globe. The atmospheric waves recorded globally exhibit amplitude and period comparable to the ones observed following the 1883 Krakatoa eruptions. In the context of the future verification of the Comprehensive Nuclear-Test-Ban Treaty, this event provides a prominent milestone for studying in detail infrasound propagation around the globe for almost one week as well as for calibrating the performance of the IMS network in a broad frequency band.|https://ui.adsabs.harvard.edu/abs/2022EGUGA..2413598V/abstract|A GLOBAL ANALYSIS OF DEEP INFRASOUND PRODUCED BY THE JANUARY 2022 ERUPTION OF HUNGA VOLCANO
conference|Atmospheric Inversion using Infrasound and Machine Learning|2022|Alex J Witsil and David Fee and Roger Waxler and Philip S Blom and Carl Tape and Quentin Brissaud|N/A|N/A|N/A|Fall Meeting 2022|AGU|N/A|https://scholar.google.com/scholar?cluster=15282691069717721851&hl=en&oi=scholarr|ATMOSPHERIC INVERSION USING INFRASOUND AND MACHINE LEARNING
