type|title|pub_year|author|volume|number|pages|journal|publisher|abstract|url|title_upper
conference|Deep learning-based method for near-real time estimation of infrasound transmission losses in theatmosphere|2025|Alice Janela Cameijo and Youcef Sklab and Souhila Arib and Alexis Le-Pichon and Samir Aknine and Quentin Brissaud and Sven Peter Näsholm|N/A|EGU25-10204|N/A|N/A|Copernicus Meetings|Accurately modeling transmission loss is essential for a variety of applications, such as improving atmospheric data assimilation for numerical weather prediction, assessing attenuation maps of sources of interest, or estimating detection capabilities of the International Monitoring System infrasound network. However, the high computational cost of numerical modeling solvers makes them impractical for a near-real-time analysis. To address this, a previous study trained a Convolutional Neural Network on regional wind fields, predicting transmission losses in less than 0, 05 seconds with a mean-squared error of 5 dB. However, this approach uses interpolated atmospheric specifications and focused only on winds, limiting its applicability for long-range modeling. In this work, we develop a convolutional recurrent network to predict transmission losses leveraging realistic, range-dependent atmospheric specifications …|https://meetingorganizer.copernicus.org/EGU25/EGU25-10204.html?pdf|DEEP LEARNING-BASED METHOD FOR NEAR-REAL TIME ESTIMATION OF INFRASOUND TRANSMISSION LOSSES IN THEATMOSPHERE
journal|Towards real-time assessment of infrasound event detection capability using deep learning-based transmission loss estimation|2025|Alice Cameijo and Alexis Le Pichon and Youcef Sklab and Arib Souhila and Quentin Brissaud and Sven Peter Näsholm and Constantino Listowski and Samir Aknine|N/A|N/A|N/A|Authorea Preprints|Authorea|Accurate modeling of infrasound transmission loss is essential for evaluating the performance of the International Monitoring System network, which monitors compliance with the Comprehensive Nuclear Test-Ban Treaty. Among existing propagation modeling tools, the parabolic equation method enables transmission loss to be finely simulated using wind and temperature atmospheric models. However, its computational cost prohibits the exploration of a large parameter space in operational monitoring applications. To address this, a recent study exploited a deep learning algorithm capable of making ground-level loss predictions almost instantaneously, similar to parabolic equation-based outputs. However, this relied on interpolated atmospheric models, leading to an incomplete representation of the medium, and did not use the temperature as part of the inputs, which makes the network not adapted for long range propagation. In the current work, we address these limitations by using both wind and temperature fields as input, simulated up to 130 km altitude and 4,000 km distance. We also optimize several aspects of the network architecture. We exploit convolutional and recurrent layers to capture spatially and range-dependent features embedded in realistic atmospheric data, improving the overall performance. The network reaches an average error of 4 dB compared to full parabolic equation simulations and provides epistemic and data-related uncertainty estimates. Its evaluation on the 2022 Tonga-Hunga Ha'apai volcanic eruption demonstrates its generalization capabilities. The model adapts to a broad range of frequencies not included …|https://essopenarchive.org/doi/full/10.22541/essoar.174051859.94658380|TOWARDS REAL-TIME ASSESSMENT OF INFRASOUND EVENT DETECTION CAPABILITY USING DEEP LEARNING-BASED TRANSMISSION LOSS ESTIMATION
conference|Global detectability estimates of venusquakes and volcanic activity from a balloon network|2024|Quentin Brissaud and Anna Gülcher and Jennifer M Jackson and John Wilding and Marouchka Froment and Sven Peter Näsholm and Iris van Zelst and Leah Sabbeth|N/A|N/A|N/A|AGU24|AGU|N/A|https://scholar.google.com/scholar?cluster=2195051285417392634&hl=en&oi=scholarr|GLOBAL DETECTABILITY ESTIMATES OF VENUSQUAKES AND VOLCANIC ACTIVITY FROM A BALLOON NETWORK
journal|Estimating stratospheric polar vortex strength using ambient ocean‐generated infrasound and stochastics‐based machine learning|2024|Ekaterina Vorobeva and Mari Dahl Eggen and Alise Danielle Midtfjord and Fred Espen Benth and Patrick Hupe and Quentin Brissaud and Yvan Orsolini and Sven Peter Näsholm|150|762|2712-2726|Quarterly Journal of the Royal Meteorological Society|UlJohn Wiley & Sons, Ltd|There are sparse opportunities for direct measurement of upper stratospheric winds, yet improving their representation in subseasonal‐to‐seasonal prediction models can have significant benefits. There is solid evidence from previous research that global atmospheric infrasound waves are sensitive to stratospheric dynamics. However, there is a lack of results providing a direct mapping between infrasound recordings and polar‐cap upper stratospheric winds. The global International Monitoring System (IMS), which monitors compliance with the Comprehensive Nuclear‐Test‐Ban Treaty, includes ground‐based stations that can be used to characterize the infrasound soundscape continuously. In this study, multi‐station IMS infrasound data were utilized along with a machine‐learning supported stochastic model, Delay‐SDE‐net, to demonstrate how a near‐real‐time estimate of the polar‐cap averaged zonal wind …|https://rmets.onlinelibrary.wiley.com/doi/abs/10.1002/qj.4731|ESTIMATING STRATOSPHERIC POLAR VORTEX STRENGTH USING AMBIENT OCEAN‐GENERATED INFRASOUND AND STOCHASTICS‐BASED MACHINE LEARNING
journal|Retrieving seismic source characteristics using seismic and infrasound data: the 2020 mb 4.9 Kiruna minequake, Sweden|2024|Antoine Turquet and Quentin Brissaud and Celso Alvizuri and Sven Peter Näsholm and Johan Kero and Alexis LePichon|N/A|N/A|N/A|Authorea Preprints|Authorea|A minequake of magnitude mb 4.9 occurred on 18 May 2020 early in the morning at the LKAB underground iron ore mine in Kiruna, Sweden. This is the largest mining-induced earthquake in Scandinavia. It generated acoustic signals observed at three infrasound arrays at 9.3 (KRIS, Sweden), 155 (IS37, Norway), and 286 km (ARCI, Norway) distance. We perform full-waveform focal mechanism inversion based on regional seismic data and local infrasound data. These independently highlight that this event was dominated by a shallow-depth collapse in agreement with in-mine seismic station data. However, regional infrasound data cannot inform the inversion process without an accurate model of atmospheric winds and temperatures. Yet, our numerical simulations demonstrate a potential of using local and regional infrasound data to constrain an event’s focal mechanism and depth.|https://www.authorea.com/doi/pdf/10.22541/essoar.169444402.26377670|RETRIEVING SEISMIC SOURCE CHARACTERISTICS USING SEISMIC AND INFRASOUND DATA: THE 2020 MB 4.9 KIRUNA MINEQUAKE, SWEDEN
journal|Seismic wave detectability on Venus using ground deformation sensors, infrasound sensors on balloons and airglow imagers|2024|Raphael F Garcia and Iris van Zelst and Taichi Kawamura and Sven Peter Näsholm and Anna Horleston and Sara Klaasen and Maxence Lefèvre and Celine Marie Solberg and Krystyna T Smolinski and Ana‐Catalina Plesa and Quentin Brissaud and Julia S Maia and Simon C Stähler and Philippe Lognonné and Mark P Panning and Anna Gülcher and Richard Ghail and Barbara De Toffoli|11|11|e2024EA003670|Earth and Space Science|N/A|The relatively unconstrained internal structure of Venus is a missing piece in our understanding of the formation and evolution of the Solar System. Detection of seismic waves generated by venusquakes is crucial to determine the seismic structure of Venus' interior, as recently shown by the new seismic and geodetic constraints on Mars' interior obtained by the InSight mission. In the next decade multiple missions will fly to Venus to explore its tectonic and volcanic activity, but they will not be able to conclusively detect seismic waves, despite their potential to detect fault movements. Looking toward the next fleet of Venus missions after the ones already decided, various concepts to measure seismic waves have been proposed. These detection methods include typical geophysical ground sensors already deployed on Earth, the Moon, and Mars; pressure sensors on balloons; and imagers of high altitude emissions …|https://agupubs.onlinelibrary.wiley.com/doi/abs/10.1029/2024EA003670|SEISMIC WAVE DETECTABILITY ON VENUS USING GROUND DEFORMATION SENSORS, INFRASOUND SENSORS ON BALLOONS AND AIRGLOW IMAGERS
journal|Constraining the Seismogenic Thickness of Venus|2024|Julia Maia and Ana-Catalina Plesa and Iris van Zelst and Quentin Brissaud and Barbara De Toffoli and Raphaël Garcia and Richard Ghail and Anna Gülcher and Anna Horleston and Taichi Kawamura and Sara Klaasen and Maxence Lefevre and Philippe Lognonné and Sven Peter Näsholm and Mark Panning and Krystyna Smolinski and Celine Solberg and Simon Stähler|17|N/A|EPSC2024-915|N/A|N/A|The surface of Venus presents a large variety of tectonic structures, from rift zones that extend thousands of kilometers [1], to globally spread wrinkle ridges [2] and coronae that could be associated with regional subduction [3]. In addition, there is a growing number of observations that point towards a geologically active Venus at present-day [4,5]. Therefore, it is highly likely that Venus is currently a seismically active planet. Yet, very little is known about the seismicity of Venus, mostly due to the lack of seismic data. Meanwhile, taking other geophysical constraints, we can start investigating some seismic properties of Venus. These analyses are essential for the planning of potential future seismic-focused missions to Venus.|https://insu.hal.science/insu-04681664/|CONSTRAINING THE SEISMOGENIC THICKNESS OF VENUS
conference|Multidisciplinary integration of FAIR Research Infrastructures in the Geo-INQUIRE initiative: the EPOS-EMSO case|2024|Kety Giuliacci and Daniele Bailo and Jan Michalek and Rossana Paciello and Valerio Vinciarelli and Claudio Goffi and Angelo Strollo and Fabrice Cotton and Harald Nedrebø and Sven Peter Näsholm and Quentin Brissaud and Tina Kaschwich and Enoc Martinez and Aljaz Maslo and Volker Röhling and Olivier Frezot and Javier Quinteros and Kuvvet Atakan and Wolfgang zu Castell|N/A|N/A|11000|EGU General Assembly Conference Abstracts|N/A|In the last decade, the scientific community has witnessed growing emphasis on data integration. The primary objective is to harness multidisciplinary data and resources to drive novel methodological approaches and scientific breakthroughs. Among the projects that have emerged in response to this trend is the Geosphere INfrastructures for QUestions into IntegratedREsearch (Geo-INQUIRE, https://www. geo-inquire. eu/). Geo-INQUIRE was launched in October 2022 and comprises a unique consortium of 51 partners, including prominent national research institutes, universities, national geological surveys, and European consortia. Geo-INQUIRE is dedicated to surmounting cross-domain challenges, particularly those pertaining to land-sea-atmosphere environments. To accomplish this mission, Geo-INQUIRE is committed to consolidating the resources and capabilities of key research infrastructures (RIs …|https://ui.adsabs.harvard.edu/abs/2024EGUGA..2611000G/abstract|MULTIDISCIPLINARY INTEGRATION OF FAIR RESEARCH INFRASTRUCTURES IN THE GEO-INQUIRE INITIATIVE: THE EPOS-EMSO CASE
conference|Balloon-Borne Seismology for Subsurface Exploration|2024|Marouchka Froment and Quentin Brissaud and Sven Peter Näsholm|N/A|N/A|N/A|AGU24|AGU|N/A|https://scholar.google.com/scholar?cluster=5242148193110602882&hl=en&oi=scholarr|BALLOON-BORNE SEISMOLOGY FOR SUBSURFACE EXPLORATION
conference|Can we reveal earthquake-induced surface deformation from ionospheric data?|2024|Ines Dahlia Ouar and Quentin Brissaud and Elvira Astafyeva|N/A|N/A|N/A|AGU24|AGU|N/A|https://scholar.google.com/scholar?cluster=2583860421892781220&hl=en&oi=scholarr|CAN WE REVEAL EARTHQUAKE-INDUCED SURFACE DEFORMATION FROM IONOSPHERIC DATA?
journal|Deep learning methods for modeling infrasound transmission loss in the middle atmosphere|2024|Alexis Le Pichon and Alice JANELA CAMEIJO and Samir Aknine and Youcef Ysklab and Souhila Arib and Quentin Brissaud|270|6|5242-5253|INTER-NOISE and NOISE-CON Congress and Conference Proceedings|Institute of Noise Control Engineering|Accurate modeling of infrasound transmission losses (TLs) is essential to assess the performance of the global International Monitoring System (IMS) infrasound network. Among existing propagation modeling tools, parabolic equation method (PE) enables TLs to be finely modeled, but its computational cost does not allow exploration of a large parameter space for operational monitoring applications. To reduce computation times, Brissaud et al. (2022) explored the potential of convolutional neural networks (CNNs) trained on a large set of regionally simulated wavefields (>1000 km from the source) to predict TLs with negligible computation times compared to PE simulations. However, this new method shows difficulties in upwind conditions, especially at low frequencies, and causal issues with winds at large distances from the source affecting ground TLs close to the source. In this study, we have developed an …|https://www.ingentaconnect.com/content/ince/incecp/2024/00000270/00000006/art00028|DEEP LEARNING METHODS FOR MODELING INFRASOUND TRANSMISSION LOSS IN THE MIDDLE ATMOSPHERE
journal|Probing a planet from the subsurface to the atmosphere with infrasound data|2024|Froment MAROUCHKA and Quentin Brissaud and Sven Peter NäSHOLM and Celine Marie SOLBERG and Tina Kaschwich and Antoine Turquet|270|5|6164-6175|INTER-NOISE and NOISE-CON Congress and Conference Proceedings|Institute of Noise Control Engineering|The analysis of infrasound waves has a significant potential for retrieving a range of geophysical parameters across various scales, such as atmospheric structures, characteristics of surface and buried sources, and seismic velocity structures. This potential was recently showcased in infrasound studies that illustrated the ability to retrieve Earth's shallow velocities and Mars' near-surface atmospheric winds from remote acoustic observations. Consequently, infrasound is becoming an essential component of planetary missions, providing insights into the interiors and atmospheres of other terrestrial planets in the solar system. However, utilizing infrasound data requires efficient forward wave simulation techniques and an accurate description of waveform sensitivity to source and medium parameters. Even under ideal conditions, many inverse problems associated with infrasound-based probing are inherently ill-posed …|https://www.ingentaconnect.com/content/ince/incecp/2024/00000270/00000005/art00018|PROBING A PLANET FROM THE SUBSURFACE TO THE ATMOSPHERE WITH INFRASOUND DATA
journal|Retrieving Seismic Source Characteristics Using Seismic and Infrasound Data: The 2020 ML 4.1 Kiruna Minequake, Sweden|2024|Antoine Turquet and Quentin Brissaud and Celso Alvizuri and Sven Peter Näsholm and Alexis Le Pichon and Johan Kero|51|12|e2024GL109276|Geophysical Research Letters|N/A|A minequake of magnitude ML 4.1 occurred on 18 May 2020 early in the morning at the LKAB underground iron ore mine in Kiruna, Sweden. This is the largest mining‐induced earthquake in Scandinavia. It generated acoustic signals observed at three infrasound arrays at 9.3 (KRIS, Sweden), 155 (IS37, Norway), and 286 km (ARCI, Norway) distance. We perform full‐waveform focal mechanism inversion based on regional seismic data and local infrasound data. These independently highlight that this event was dominated by a shallow‐depth collapse in agreement with in‐mine seismic station data. However, regional infrasound data cannot inform the inversion process without an accurate model of atmospheric winds and temperatures. Yet, our numerical simulations demonstrate a potential of using local and regional infrasound data to constrain an event's focal mechanism and depth.|https://agupubs.onlinelibrary.wiley.com/doi/abs/10.1029/2024GL109276|RETRIEVING SEISMIC SOURCE CHARACTERISTICS USING SEISMIC AND INFRASOUND DATA: THE 2020 ML 4.1 KIRUNA MINEQUAKE, SWEDEN
conference|Exploring the feasibility of detecting seismically-generated infrasound waves on Venus using balloon platforms|2024|Sven Peter Näsholm and Quentin Brissaud and Celine Marie Solberg and Marouchka Froment|N/A|N/A|12783|EGU General Assembly Conference Abstracts|N/A|Seismic waves are a primary source of information for our understanding of Earth's internal structure and they provide important constraints on subsurface seismic-velocity properties. However, traditional inversion methods cannot be implemented in regions of limited seismic-station coverage, in particular on Venus due to its harsh surface conditions but also in remote Earth regions. This lack of seismic data greatly limits our understanding of Venus' origin and evolution and Earth's subsurface. A window of opportunity is offered by the mechanical coupling between the ground and its atmosphere, which enables the seismic energy to be transmitted into the atmosphere as low-frequency acoustic waves carrying information about the seismic source and the subsurface properties. While infrasound is traditionally recorded at ground-based stations, which suffers from the same in-situ deployment limitations as seismic …|https://ui.adsabs.harvard.edu/abs/2024EGUGA..2612783N/abstract|EXPLORING THE FEASIBILITY OF DETECTING SEISMICALLY-GENERATED INFRASOUND WAVES ON VENUS USING BALLOON PLATFORMS
conference|Near-real time detection of conflict-related explosions or suspicious events using seismological data|2024|Bettina Goertz-Allmann and Ben DE Dando and Andreas Koehler and Quentin Brissaud and Johannes Schweitzer and Tormod Kværna|N/A|N/A|8735|EGU General Assembly Conference Abstracts|N/A|Apart from classical earthquake monitoring, seismological data can also be used to detect explosions in near-real-time on both regional and global scales. We demonstrate how seismic and infrasound data can provide more comprehensive and objective information about conflict-related explosions or suspicious events that might be the result of targeted attacks. We can identify the underwater explosions at the Nord Stream pipeline infrastructure in the Baltic Sea in September 2022. Cross-correlation analysis allowed us to identify sub-events several seconds apart which can be associate with specific locations along the pipelines. Furthermore, we detect a signal at the Finish seismic array in October 2023 which may be associated with the damage along the Balticconnector. The other example is from Ukraine, where we present the ability to automatically identify and locate ground explosions related to the Russia …|https://ui.adsabs.harvard.edu/abs/2024EGUGA..26.8735G/abstract|NEAR-REAL TIME DETECTION OF CONFLICT-RELATED EXPLOSIONS OR SUSPICIOUS EVENTS USING SEISMOLOGICAL DATA
journal|Introduction to the Special Section on Seismoacoustics and Seismoacoustic Data Fusion|2023|Fransiska K Dannemann Dugick and Jordan W Bishop and Léo Martire and Alexandra M Iezzi and Jelle D Assink and Quentin Brissaud and Stephen Arrowsmith|113|4|1383-1389|Bulletin of the Seismological Society of America|Seismological Society of America|A variety of geophysical hazards (eg, volcanic activity, earthquakes, mass movements, marine storms, and bolides) and anthropogenic sources (eg, chemical and nuclear explosions, mining blasts, rocket launches, and military activity) can release energy as mechanical waves in the ground, ocean, and atmosphere (Campus and Christie, 2009; Arrowsmith et al., 2010). Because of the mechanical coupling between a planetary body, its ocean, and its atmosphere, waves propagate across these interfaces (Ben-Menahem and Singh, 1981) and carry information about the source and the media they propagated through. The field of seismoacoustics, driven by geophysical observations of both seismic and low-frequency acoustic (infrasound) waves, has several interdisciplinary applications. Observations of both seismic and infrasonic waves can be used to discriminate between atmospheric and subsurface events such …|https://pubs.geoscienceworld.org/ssa/bssa/article-abstract/113/4/1383/624450|INTRODUCTION TO THE SPECIAL SECTION ON SEISMOACOUSTICS AND SEISMOACOUSTIC DATA FUSION
conference|Toward automatic near-real-time detection of travelling ionospheric disturbances (TIDs) driven by lower atmosphere and near-surface geophysical events|2023|Elvira Astafyeva and Quentin Brissaud and Boris Maletckii and Saúl Alejandro Sánchez Juarez and Rogério Hisashi Honda and Esfhan Alam Kherani and Ines Dahlia Ouar and Michela Ravanelli|2023|2712|SA23B-2712|AGU Fall Meeting Abstracts|N/A|Lower atmosphere and geophysical near-surface events such as severe weather and natural hazard events generate acoustic and gravity waves and perturb the ionosphere, generating travelling ionospheric disturbances (TIDs). The TIDs manifest themselves as fluctuations of plasma density that propagate as waves. Near-real-time (NRT) detection, characterization and tracking of TIDs are of the greatest importance for Space Weather applications, but also for future monitoring and assessment of natural hazards from the ionosphere. This contribution will present our recent developments in the field of automatic NRT detection of TIDs of different origins in data series of total electron content (TEC) by GNSS. Recently, two NRT-compatible methods have been developed by our research team. The first one can both capture disturbances with high TEC derivative (dTEC/dt) and determine their velocity and direction of …|https://ui.adsabs.harvard.edu/abs/2023AGUFMSA23B2712A/abstract|TOWARD AUTOMATIC NEAR-REAL-TIME DETECTION OF TRAVELLING IONOSPHERIC DISTURBANCES (TIDS) DRIVEN BY LOWER ATMOSPHERE AND NEAR-SURFACE GEOPHYSICAL EVENTS
conference|Real-time monitoring of the Russia-Ukraine conflict using seismic and infrasound array data|2023|Ben DE Dando and Bettina P Goertz-Allmann and Quentin Brissaud and Andreas Köhler and Johannes Schweitzer and Tormod Kværna|N/A|N/A|EGU-11829|EGU General Assembly Conference Abstracts|N/A|Since the invasion of Ukraine in February 2022, daily media reports have shown the shocking effects of fighting and the inevitable devastation associated with war. However, getting a comprehensive and unbiased overview of the ongoing military attacks remains a challenge. The availability of geophysical data that can identify individual attacks provides much needed objectivity to this problem. The pressure waves generated by an explosion travel through the atmosphere and subsurface as sound and seismic waves, and their signature can be recorded by arrays of seismometers for ground motion or microbarometers for sound propagation. In this work, we demonstrate the first known case of using seismological data to detect conflict-related explosions in near-real-time. Using the Ukrainian primary station of the International Monitoring System (IMS), the Malin array (AKASG), we automatically locate explosions …|https://ui.adsabs.harvard.edu/abs/2023EGUGA..2511829D/abstract|REAL-TIME MONITORING OF THE RUSSIA-UKRAINE CONFLICT USING SEISMIC AND INFRASOUND ARRAY DATA
conference|Progress Towards Balloon-Based Seismic Studies on Venus|2023|Siddharth Krishnamoorthy and Daniel C Bowman and Emalee Hough and Zach Yap and Solène Gérier and John Wilding and Léo Martire and Taylor Swaim and Jamey Jacob and Brian R Elbing and Attila Komjathy and James A Cutts and Jennifer M Jackson|2023|3147|P31F-3147|AGU fall meeting abstracts|N/A|Adverse conditions on the surface of Venus have thus far prevented long-duration seismic studies. Traditional seismology on the surface of Venus using a long-lived lander is a formidable technological challenge. Since 2016, we have been developing remote sensing technology that would enable the detection and characterization of putative Venusian seismic activity from balloons in its upper atmosphere. Infrasound (acoustic waves with frequency< 20Hz) has been recorded from a variety of events on Earth. Of particular interest to Venus exploration are infrasound signals from quakes, volcanic eruptions, thunderstorms, and meteors. Venus offers a unique opportunity for the use of infrasound as an investigative tool for surface ground motion-due to its dense atmosphere, energy from seismic activity couples with the Venusian atmosphere up to 60 times more efficiently than Earth. The main advantage of performing …|https://ui.adsabs.harvard.edu/abs/2023AGUFM.P31F3147K/abstract|PROGRESS TOWARDS BALLOON-BASED SEISMIC STUDIES ON VENUS
conference|A FAIR approach for the integration of scientific services in the Geo-INQUIRE initiative|2023|Kety Giuliacci and Daniele Bailo and Jan Michalek and Rossana Paciello and Valerio Vinciarelli and Claudio Goffi and Angelo Strollo and Fabrice Cotton and Harald Nedrebø and Sven Peter Näsholm and Quentin Brissaud and Mari Nesse and Tina Kaschwich and Enoc Martinez and Volker Röhling and Muhammed Mikail Farooqui and Olivier Frezot and Javier Quinteros and Kuvvet Atakan and Wolfgang Castell|2023|58|IN41B-058|AGU Fall Meeting Abstracts|N/A|In recent years, there has been a growing trend in science towards data integration, with the purpose of using multidisciplinary data and products to foster new methodological approaches and scientific discoveries. One of the many projects that have emerged is the Geosphere INfrastructures for QUestions into Integrated REsearch (Geo-INQUIRE).|https://ui.adsabs.harvard.edu/abs/2023AGUFMIN41B05.8G/abstract|A FAIR APPROACH FOR THE INTEGRATION OF SCIENTIFIC SERVICES IN THE GEO-INQUIRE INITIATIVE
